{
  "masqueArtifact": "population-estimates",
  "unitOfAnalysis": "person",
  "generatedAt": "2026-09-28T06:03:27Z",
  "producedBy": "masque_population_etl.R 0.6.0 / R survey 4.2.1",
  "source": {
    "dataset": "NHANES",
    "cycle": "1999-2000",
    "file": "nhanes_1999_2000.csv",
    "steward": "CDC/NCHS",
    "url": "https://wwwn.cdc.gov/Nchs/Data/Nhanes/Public/1999/DataFiles/",
    "sha256": "91a69461824ca3365c10e62ec285b4787b1116c93c7ecdfda3097f19409bf02b",
    "downloadedAt": "2026-09-24"
  },
  "design": {
    "weight": "WTINT2YR",
    "strata": "SDMVSTRA",
    "psu": "SDMVPSU",
    "nest": true,
    "lonelyPsu": "adjust",
    "varianceMethod": "Taylor linearization",
    "domainAnalysis": true
  },
  "phenotype": {
    "definition": "Severe headaches or migraines (MPQ090 = yes) AND at least one of: dizziness or balance problems in the past year (BAQ020A or BAQ020B = yes; a 'no' to the gate question BAQ010 counts as no), any reported hearing trouble (AUQ130 = a little trouble, a lot of trouble, or deaf), or ears ringing, roaring or buzzing in the past year (AUQ190 = yes). Adults aged 40 and over; complete cases only. This is the proposal <U+00A7>7.1 phenotype narrowed to what NHANES 1999-2004 can express: no sinonasal arm and no recalcitrance (utilization) arm.",
    "rule": {
      "all": ["headache_migraine"],
      "any": ["dizziness_balance", "hearing_difficulty", "tinnitus"],
      "completeCase": true
    },
    "eligibility": {
      "var": "RIDAGEYR",
      "min": 40,
      "reason": "The Balance questionnaire (BAQ) was administered to respondents aged 40 and over; the pain and audiometry questionnaire items used were asked of ages 20 and over, so adults 40+ are the population with every phenotype item. Verified in the data: BAQ010 is answered by ages 40-85 only.",
      "eligibleRespondents": 3185,
      "allRespondents": 9965
    },
    "variableMap": {
      "headache_migraine": "MPQ090",
      "dizziness_balance": ["BAQ020A", "BAQ020B"],
      "hearing_difficulty": "AUQ130",
      "sinus_condition": null,
      "recalcitrance_proxy": null,
      "tinnitus": "AUQ190"
    },
    "questionText": {
      "headache_migraine": "File label: \"Severe headaches or migraines\" (Miscellaneous Pain questionnaire, MPQ090; asked of ages 20+; 1 = yes, 2 = no).",
      "dizziness_balance": "File labels: \"Dizziness problems in past year\" (BAQ020A) and \"Balance problems in past year\" (BAQ020B), Balance questionnaire, ages 40+; either = yes counts. Falling problems alone (BAQ020C) do not count.",
      "hearing_difficulty": "File label: \"General condition of hearing\" (Audiometry questionnaire, AUQ130). Codes 2, 3 and 4 (a little trouble / a lot of trouble / deaf, per the NHANES AUQ code frame) count as difficulty; 1 = good. Code frame to be re-verified against the codebook by the clinical lead.",
      "sinus_condition": "",
      "recalcitrance_proxy": "",
      "tinnitus": "File label: \"Ears ringing, roaring, buzzing past year\" (Audiometry questionnaire, AUQ190; asked of ages 20+; 1 = yes, 2 = no)."
    },
    "mapFile": "phenotype_map_nhanes_1999_2000.json",
    "mapVersion": "0.2.0",
    "unmapped": ["sinus_condition", "recalcitrance_proxy"]
  },
  "estimates": [
    {
      "name": "phenotype_prevalence",
      "unit": "proportion",
      "estimate": 0.115129841156158,
      "se": 0.00848285606210706,
      "ci": [0.0969359243986276, 0.133323757913688],
      "unweightedN": 3160,
      "unweightedPositives": 364,
      "weightedN": 106718138.945882,
      "df": 14,
      "rse": 0.0736807762168389,
      "suppress": false
    },
    {
      "name": "phenotype_prevalence",
      "unit": "proportion",
      "domain": "sex=female",
      "estimate": 0.141691425005009,
      "se": 0.0109437959687069,
      "ci": [0.118219317096038, 0.16516353291398],
      "unweightedN": 1625,
      "unweightedPositives": 233,
      "weightedN": 56980013.8305715,
      "df": 14,
      "rse": 0.0772368262110432,
      "suppress": false
    },
    {
      "name": "phenotype_prevalence",
      "unit": "proportion",
      "domain": "sex=male",
      "estimate": 0.0847008812474225,
      "se": 0.012269197656855,
      "ci": [0.0583860694415677, 0.111015693053277],
      "unweightedN": 1535,
      "unweightedPositives": 131,
      "weightedN": 49738125.1153101,
      "df": 14,
      "rse": 0.144853246815874,
      "suppress": false
    }
  ],
  "caveats": ["Screening-level phenotype prevalence, not diagnosed prevalence. No vestibular-testing or ICHD/Barany reference standard exists in these data.", "Self-reported survey items; coding inconsistency may bias phenotype capture.", "Hypothesis-generating estimate, not a diagnostic count.", "Respondents coded Refused / Not Ascertained / Don't Know on a phenotype item are excluded from the denominator, never counted as negative.", "Complete-case phenotype: a respondent missing any item the rule uses is excluded from the denominator.", "Estimated within the eligible subpopulation only (RIDAGEYR >= 40): The Balance questionnaire (BAQ) was administered to respondents aged 40 and over; the pain and audiometry questionnaire items used were asked of ages 20 and over, so adults 40+ are the population with every phenotype item. Verified in the data: BAQ010 is answered by ages 40-85 only.", "Concepts this cycle could not express: sinus_condition, recalcitrance_proxy. The phenotype reported here is narrower than the one defined in proposal 7.1.", "No gender-identity item in this cycle: estimates are stratified by sex only. Gender is not substituted from sex."]
}
