{
  "masqueArtifact": "population-estimates",
  "unitOfAnalysis": "person",
  "generatedAt": "2026-09-28T06:03:46Z",
  "producedBy": "masque_population_etl.R 0.6.0 / R survey 4.2.1",
  "source": {
    "dataset": "NHIS",
    "cycle": "2021",
    "file": "adult21.csv",
    "steward": "CDC/NCHS",
    "url": "https://ftp.cdc.gov/pub/Health_Statistics/NCHS/Datasets/NHIS/2021/adult21csv.zip",
    "sha256": "4dc1d360065111b445c5dcea15fe9a7d777650ed106f0522e540eb88199c6c01"
  },
  "design": {
    "weight": "WTFA_A",
    "strata": "PSTRAT",
    "psu": "PPSU",
    "nest": true,
    "lonelyPsu": "adjust",
    "varianceMethod": "Taylor linearization",
    "domainAnalysis": true
  },
  "phenotype": {
    "definition": "Head or face pain on some days or more in the past 3 months (PAIHDFC3M_A 2-4; 'never had any pain' counts as no) AND any hearing difficulty even with a hearing aid (HEARINGDF_A 2-4). All adults 18+; complete cases only. Narrower than the 2023 artifact: NHIS 2021 fielded no dizziness/balance or tinnitus item, so the otologic arm is hearing only; no sinonasal or recalcitrance arm.",
    "rule": {
      "all": ["headache_migraine"],
      "any": ["hearing_difficulty"],
      "completeCase": true
    },
    "variableMap": {
      "headache_migraine": "PAIHDFC3M_A",
      "dizziness_balance": null,
      "hearing_difficulty": "HEARINGDF_A",
      "tinnitus": null,
      "sinus_condition": null,
      "recalcitrance_proxy": null
    },
    "questionText": {
      "headache_migraine": "PAIHDFC3M_A, NHIS pain module (odd years), pain-location item for head or face ('HDFC'), 'how often in the past 3 months': 1 never, 2 some days, 3 most days, 4 every day. Positive = some days or more. Asked only of adults reporting any pain in the past 3 months (PAIFRQ3M_A = 2-4); a 'never' at that gate counts as no. Broader than NHANES MPQ090 'severe headaches or migraines': this item has no severity qualifier, so prevalence is not comparable to NHANES without the sensitivity run described in the map note.",
      "dizziness_balance": "",
      "hearing_difficulty": "HEARINGDF_A, Washington Group short set, 'difficulty hearing, even when using a hearing aid': 1 no difficulty, 2 some difficulty, 3 a lot of difficulty, 4 cannot do at all. Positive = some difficulty or more. Asked of all adults every year.",
      "tinnitus": "",
      "sinus_condition": "",
      "recalcitrance_proxy": ""
    },
    "mapFile": "phenotype_map_nhis_2021.json",
    "mapVersion": "0.2.0",
    "unmapped": ["dizziness_balance", "tinnitus", "sinus_condition", "recalcitrance_proxy"]
  },
  "estimates": [
    {
      "name": "phenotype_prevalence",
      "unit": "proportion",
      "estimate": 0.0468483863267951,
      "se": 0.00158399113695806,
      "ci": [0.0437374497938476, 0.0499593228597426],
      "unweightedN": 28715,
      "unweightedPositives": 1427,
      "weightedN": 246484755.557,
      "df": 591,
      "rse": 0.0338110074039432,
      "suppress": false
    },
    {
      "name": "phenotype_prevalence",
      "unit": "proportion",
      "domain": "sex=male",
      "estimate": 0.0413977974748861,
      "se": 0.00204965631050317,
      "ci": [0.0373722870254367, 0.0454233079243355],
      "unweightedN": 13041,
      "unweightedPositives": 551,
      "weightedN": 119200092.541,
      "df": 590,
      "rse": 0.049511240585845,
      "suppress": false
    },
    {
      "name": "phenotype_prevalence",
      "unit": "proportion",
      "domain": "sex=female",
      "estimate": 0.0519594746282517,
      "se": 0.00231340622512464,
      "ci": [0.0474159770206139, 0.0565029722358895],
      "unweightedN": 15672,
      "unweightedPositives": 876,
      "weightedN": 127268256.835,
      "df": 591,
      "rse": 0.0445232797613159,
      "suppress": false
    }
  ],
  "caveats": ["Screening-level phenotype prevalence, not diagnosed prevalence. No vestibular-testing or ICHD/Barany reference standard exists in these data.", "Self-reported survey items; coding inconsistency may bias phenotype capture.", "Hypothesis-generating estimate, not a diagnostic count.", "Respondents coded Refused / Not Ascertained / Don't Know on a phenotype item are excluded from the denominator, never counted as negative.", "Complete-case phenotype: a respondent missing any item the rule uses is excluded from the denominator.", "Concepts this cycle could not express: dizziness_balance, tinnitus, sinus_condition, recalcitrance_proxy. The phenotype reported here is narrower than the one defined in proposal 7.1.", "No gender-identity item in this cycle: estimates are stratified by sex only. Gender is not substituted from sex."]
}
